No.     Time           Source                Destination           Protocol Length Info
      1 0.000000000    127.0.0.1             127.0.0.1             TCP      74     40552 → 8000 [SYN] Seq=0 Win=65495 Len=0 MSS=65495 SACK_PERM=1 TSval=4068942916 TSecr=0 WS=128

Frame 1: 74 bytes on wire (592 bits), 74 bytes captured (592 bits) on interface lo, id 0
Ethernet II, Src: 00:00:00_00:00:00 (00:00:00:00:00:00), Dst: 00:00:00_00:00:00 (00:00:00:00:00:00)
Internet Protocol Version 4, Src: 127.0.0.1, Dst: 127.0.0.1
Transmission Control Protocol, Src Port: 40552, Dst Port: 8000, Seq: 0, Len: 0

No.     Time           Source                Destination           Protocol Length Info
      2 0.000009410    127.0.0.1             127.0.0.1             TCP      74     8000 → 40552 [SYN, ACK] Seq=0 Ack=1 Win=65483 Len=0 MSS=65495 SACK_PERM=1 TSval=4068942916 TSecr=4068942916 WS=128

Frame 2: 74 bytes on wire (592 bits), 74 bytes captured (592 bits) on interface lo, id 0
Ethernet II, Src: 00:00:00_00:00:00 (00:00:00:00:00:00), Dst: 00:00:00_00:00:00 (00:00:00:00:00:00)
Internet Protocol Version 4, Src: 127.0.0.1, Dst: 127.0.0.1
Transmission Control Protocol, Src Port: 8000, Dst Port: 40552, Seq: 0, Ack: 1, Len: 0

No.     Time           Source                Destination           Protocol Length Info
      3 0.000017581    127.0.0.1             127.0.0.1             TCP      66     40552 → 8000 [ACK] Seq=1 Ack=1 Win=65536 Len=0 TSval=4068942916 TSecr=4068942916

Frame 3: 66 bytes on wire (528 bits), 66 bytes captured (528 bits) on interface lo, id 0
Ethernet II, Src: 00:00:00_00:00:00 (00:00:00:00:00:00), Dst: 00:00:00_00:00:00 (00:00:00:00:00:00)
Internet Protocol Version 4, Src: 127.0.0.1, Dst: 127.0.0.1
Transmission Control Protocol, Src Port: 40552, Dst Port: 8000, Seq: 1, Ack: 1, Len: 0

No.     Time           Source                Destination           Protocol Length Info
      4 0.000044963    127.0.0.1             127.0.0.1             HTTP/JSON 214    POST / HTTP/1.1 , JavaScript Object Notation (application/json)

Frame 4: 214 bytes on wire (1712 bits), 214 bytes captured (1712 bits) on interface lo, id 0
Ethernet II, Src: 00:00:00_00:00:00 (00:00:00:00:00:00), Dst: 00:00:00_00:00:00 (00:00:00:00:00:00)
Internet Protocol Version 4, Src: 127.0.0.1, Dst: 127.0.0.1
Transmission Control Protocol, Src Port: 40552, Dst Port: 8000, Seq: 1, Ack: 1, Len: 148
Hypertext Transfer Protocol
    POST / HTTP/1.1\r\n
    Host: 127.0.0.1:8000\r\n
    User-Agent: curl/7.81.0\r\n
    Accept: */*\r\n
    Content-Type: application/json\r\n
    Content-Length: 17\r\n
    \r\n
    [Full request URI: http://127.0.0.1:8000/]
    [HTTP request 1/1]
    [Response in frame: 6]
    File Data: 17 bytes
JavaScript Object Notation: application/json
    Object
        Member: nombre
            [Path with value: /nombre:John]
            [Member with value: nombre:John]
            String value: John
            Key: nombre
            [Path: /nombre]

No.     Time           Source                Destination           Protocol Length Info
      5 0.000048333    127.0.0.1             127.0.0.1             TCP      66     8000 → 40552 [ACK] Seq=1 Ack=149 Win=65408 Len=0 TSval=4068942916 TSecr=4068942916

Frame 5: 66 bytes on wire (528 bits), 66 bytes captured (528 bits) on interface lo, id 0
Ethernet II, Src: 00:00:00_00:00:00 (00:00:00:00:00:00), Dst: 00:00:00_00:00:00 (00:00:00:00:00:00)
Internet Protocol Version 4, Src: 127.0.0.1, Dst: 127.0.0.1
Transmission Control Protocol, Src Port: 8000, Dst Port: 40552, Seq: 1, Ack: 149, Len: 0

No.     Time           Source                Destination           Protocol Length Info
      6 0.000798081    127.0.0.1             127.0.0.1             HTTP     293    HTTP/1.1 200 OK  (text/html)

Frame 6: 293 bytes on wire (2344 bits), 293 bytes captured (2344 bits) on interface lo, id 0
Ethernet II, Src: 00:00:00_00:00:00 (00:00:00:00:00:00), Dst: 00:00:00_00:00:00 (00:00:00:00:00:00)
Internet Protocol Version 4, Src: 127.0.0.1, Dst: 127.0.0.1
Transmission Control Protocol, Src Port: 8000, Dst Port: 40552, Seq: 1, Ack: 149, Len: 227
Hypertext Transfer Protocol
    HTTP/1.1 200 OK\r\n
    Content-Type: text/html\r\n
    Date: Wed, 22 May 2024 12:50:32 GMT\r\n
    Connection: keep-alive\r\n
    Keep-Alive: timeout=5\r\n
    Transfer-Encoding: chunked\r\n
    \r\n
    [HTTP response 1/1]
    [Time since request: 0.000753118 seconds]
    [Request in frame: 4]
    [Request URI: http://127.0.0.1:8000/]
    HTTP chunked response
    File Data: 60 bytes
Line-based text data: text/html (3 lines)
    \n
        <h1>Hello!</h1>\n
        <p>You asked for <code>/</code></p>

No.     Time           Source                Destination           Protocol Length Info
      7 0.000805772    127.0.0.1             127.0.0.1             TCP      66     40552 → 8000 [ACK] Seq=149 Ack=228 Win=65408 Len=0 TSval=4068942916 TSecr=4068942916

Frame 7: 66 bytes on wire (528 bits), 66 bytes captured (528 bits) on interface lo, id 0
Ethernet II, Src: 00:00:00_00:00:00 (00:00:00:00:00:00), Dst: 00:00:00_00:00:00 (00:00:00:00:00:00)
Internet Protocol Version 4, Src: 127.0.0.1, Dst: 127.0.0.1
Transmission Control Protocol, Src Port: 40552, Dst Port: 8000, Seq: 149, Ack: 228, Len: 0

No.     Time           Source                Destination           Protocol Length Info
      8 0.000915819    127.0.0.1             127.0.0.1             TCP      66     40552 → 8000 [FIN, ACK] Seq=149 Ack=228 Win=65536 Len=0 TSval=4068942916 TSecr=4068942916

Frame 8: 66 bytes on wire (528 bits), 66 bytes captured (528 bits) on interface lo, id 0
Ethernet II, Src: 00:00:00_00:00:00 (00:00:00:00:00:00), Dst: 00:00:00_00:00:00 (00:00:00:00:00:00)
Internet Protocol Version 4, Src: 127.0.0.1, Dst: 127.0.0.1
Transmission Control Protocol, Src Port: 40552, Dst Port: 8000, Seq: 149, Ack: 228, Len: 0

No.     Time           Source                Destination           Protocol Length Info
      9 0.001031256    127.0.0.1             127.0.0.1             TCP      66     8000 → 40552 [FIN, ACK] Seq=228 Ack=150 Win=65536 Len=0 TSval=4068942917 TSecr=4068942916

Frame 9: 66 bytes on wire (528 bits), 66 bytes captured (528 bits) on interface lo, id 0
Ethernet II, Src: 00:00:00_00:00:00 (00:00:00:00:00:00), Dst: 00:00:00_00:00:00 (00:00:00:00:00:00)
Internet Protocol Version 4, Src: 127.0.0.1, Dst: 127.0.0.1
Transmission Control Protocol, Src Port: 8000, Dst Port: 40552, Seq: 228, Ack: 150, Len: 0

No.     Time           Source                Destination           Protocol Length Info
     10 0.001042567    127.0.0.1             127.0.0.1             TCP      66     40552 → 8000 [ACK] Seq=150 Ack=229 Win=65536 Len=0 TSval=4068942917 TSecr=4068942917

Frame 10: 66 bytes on wire (528 bits), 66 bytes captured (528 bits) on interface lo, id 0
Ethernet II, Src: 00:00:00_00:00:00 (00:00:00:00:00:00), Dst: 00:00:00_00:00:00 (00:00:00:00:00:00)
Internet Protocol Version 4, Src: 127.0.0.1, Dst: 127.0.0.1
Transmission Control Protocol, Src Port: 40552, Dst Port: 8000, Seq: 150, Ack: 229, Len: 0

No.     Time           Source                Destination           Protocol Length Info
     11 20.120301995   127.0.0.1             127.0.0.53            DNS      75     Standard query 0xb58c A ssl.gstatic.com

Frame 11: 75 bytes on wire (600 bits), 75 bytes captured (600 bits) on interface lo, id 0
Ethernet II, Src: 00:00:00_00:00:00 (00:00:00:00:00:00), Dst: 00:00:00_00:00:00 (00:00:00:00:00:00)
Internet Protocol Version 4, Src: 127.0.0.1, Dst: 127.0.0.53
User Datagram Protocol, Src Port: 9742, Dst Port: 53
Domain Name System (query)

No.     Time           Source                Destination           Protocol Length Info
     12 20.120336147   127.0.0.1             127.0.0.53            DNS      75     Standard query 0x6c46 HTTPS ssl.gstatic.com

Frame 12: 75 bytes on wire (600 bits), 75 bytes captured (600 bits) on interface lo, id 0
Ethernet II, Src: 00:00:00_00:00:00 (00:00:00:00:00:00), Dst: 00:00:00_00:00:00 (00:00:00:00:00:00)
Internet Protocol Version 4, Src: 127.0.0.1, Dst: 127.0.0.53
User Datagram Protocol, Src Port: 26910, Dst Port: 53
Domain Name System (query)

No.     Time           Source                Destination           Protocol Length Info
     13 20.133495150   127.0.0.53            127.0.0.1             DNS      132    Standard query response 0x6c46 HTTPS ssl.gstatic.com SOA ns1.google.com

Frame 13: 132 bytes on wire (1056 bits), 132 bytes captured (1056 bits) on interface lo, id 0
Ethernet II, Src: 00:00:00_00:00:00 (00:00:00:00:00:00), Dst: 00:00:00_00:00:00 (00:00:00:00:00:00)
Internet Protocol Version 4, Src: 127.0.0.53, Dst: 127.0.0.1
User Datagram Protocol, Src Port: 53, Dst Port: 26910
Domain Name System (response)

No.     Time           Source                Destination           Protocol Length Info
     14 20.134080567   127.0.0.53            127.0.0.1             DNS      91     Standard query response 0xb58c A ssl.gstatic.com A 142.251.133.35

Frame 14: 91 bytes on wire (728 bits), 91 bytes captured (728 bits) on interface lo, id 0
Ethernet II, Src: 00:00:00_00:00:00 (00:00:00:00:00:00), Dst: 00:00:00_00:00:00 (00:00:00:00:00:00)
Internet Protocol Version 4, Src: 127.0.0.53, Dst: 127.0.0.1
User Datagram Protocol, Src Port: 53, Dst Port: 9742
Domain Name System (response)

No.     Time           Source                Destination           Protocol Length Info
     15 41.740129648   127.0.0.1             127.0.0.53            DNS      78     Standard query 0xe157 A www.googleapis.com

Frame 15: 78 bytes on wire (624 bits), 78 bytes captured (624 bits) on interface lo, id 0
Ethernet II, Src: 00:00:00_00:00:00 (00:00:00:00:00:00), Dst: 00:00:00_00:00:00 (00:00:00:00:00:00)
Internet Protocol Version 4, Src: 127.0.0.1, Dst: 127.0.0.53
User Datagram Protocol, Src Port: 6072, Dst Port: 53
Domain Name System (query)

No.     Time           Source                Destination           Protocol Length Info
     16 41.740176661   127.0.0.1             127.0.0.53            DNS      78     Standard query 0x3a7e HTTPS www.googleapis.com

Frame 16: 78 bytes on wire (624 bits), 78 bytes captured (624 bits) on interface lo, id 0
Ethernet II, Src: 00:00:00_00:00:00 (00:00:00:00:00:00), Dst: 00:00:00_00:00:00 (00:00:00:00:00:00)
Internet Protocol Version 4, Src: 127.0.0.1, Dst: 127.0.0.53
User Datagram Protocol, Src Port: 45936, Dst Port: 53
Domain Name System (query)

No.     Time           Source                Destination           Protocol Length Info
     17 41.768574617   127.0.0.53            127.0.0.1             DNS      334    Standard query response 0xe157 A www.googleapis.com A 172.217.173.234 A 216.58.202.74 A 216.58.202.106 A 142.250.79.74 A 142.250.79.106 A 142.250.79.138 A 142.251.133.10 A 142.251.133.42 A 142.251.133.74 A 142.251.133.202 A 142.251.133.234 A 142.251.134.10 A 142.251.134.42 A 142.251.134.74 A 172.217.172.74 A 172.217.172.106

Frame 17: 334 bytes on wire (2672 bits), 334 bytes captured (2672 bits) on interface lo, id 0
Ethernet II, Src: 00:00:00_00:00:00 (00:00:00:00:00:00), Dst: 00:00:00_00:00:00 (00:00:00:00:00:00)
Internet Protocol Version 4, Src: 127.0.0.53, Dst: 127.0.0.1
User Datagram Protocol, Src Port: 53, Dst Port: 6072
Domain Name System (response)

No.     Time           Source                Destination           Protocol Length Info
     18 41.768638851   127.0.0.53            127.0.0.1             DNS      135    Standard query response 0x3a7e HTTPS www.googleapis.com SOA ns1.google.com

Frame 18: 135 bytes on wire (1080 bits), 135 bytes captured (1080 bits) on interface lo, id 0
Ethernet II, Src: 00:00:00_00:00:00 (00:00:00:00:00:00), Dst: 00:00:00_00:00:00 (00:00:00:00:00:00)
Internet Protocol Version 4, Src: 127.0.0.53, Dst: 127.0.0.1
User Datagram Protocol, Src Port: 53, Dst Port: 45936
Domain Name System (response)

No.     Time           Source                Destination           Protocol Length Info
     19 41.871516081   127.0.0.1             127.0.0.53            DNS      97     Standard query 0x786f A accountcapabilities-pa.googleapis.com

Frame 19: 97 bytes on wire (776 bits), 97 bytes captured (776 bits) on interface lo, id 0
Ethernet II, Src: 00:00:00_00:00:00 (00:00:00:00:00:00), Dst: 00:00:00_00:00:00 (00:00:00:00:00:00)
Internet Protocol Version 4, Src: 127.0.0.1, Dst: 127.0.0.53
User Datagram Protocol, Src Port: 36751, Dst Port: 53
Domain Name System (query)

No.     Time           Source                Destination           Protocol Length Info
     20 41.871543653   127.0.0.1             127.0.0.53            DNS      97     Standard query 0xf39a HTTPS accountcapabilities-pa.googleapis.com

Frame 20: 97 bytes on wire (776 bits), 97 bytes captured (776 bits) on interface lo, id 0
Ethernet II, Src: 00:00:00_00:00:00 (00:00:00:00:00:00), Dst: 00:00:00_00:00:00 (00:00:00:00:00:00)
Internet Protocol Version 4, Src: 127.0.0.1, Dst: 127.0.0.53
User Datagram Protocol, Src Port: 13959, Dst Port: 53
Domain Name System (query)

No.     Time           Source                Destination           Protocol Length Info
     21 41.880198761   127.0.0.53            127.0.0.1             DNS      353    Standard query response 0x786f A accountcapabilities-pa.googleapis.com A 216.58.202.74 A 216.58.202.106 A 142.250.79.74 A 142.250.79.106 A 142.250.79.138 A 142.251.133.10 A 142.251.133.42 A 142.251.133.74 A 142.251.133.202 A 142.251.133.234 A 142.251.134.10 A 142.251.134.42 A 142.251.134.74 A 172.217.172.74 A 172.217.172.106 A 172.217.173.234

Frame 21: 353 bytes on wire (2824 bits), 353 bytes captured (2824 bits) on interface lo, id 0
Ethernet II, Src: 00:00:00_00:00:00 (00:00:00:00:00:00), Dst: 00:00:00_00:00:00 (00:00:00:00:00:00)
Internet Protocol Version 4, Src: 127.0.0.53, Dst: 127.0.0.1
User Datagram Protocol, Src Port: 53, Dst Port: 36751
Domain Name System (response)

No.     Time           Source                Destination           Protocol Length Info
     22 41.904454209   127.0.0.53            127.0.0.1             DNS      154    Standard query response 0xf39a HTTPS accountcapabilities-pa.googleapis.com SOA ns1.google.com

Frame 22: 154 bytes on wire (1232 bits), 154 bytes captured (1232 bits) on interface lo, id 0
Ethernet II, Src: 00:00:00_00:00:00 (00:00:00:00:00:00), Dst: 00:00:00_00:00:00 (00:00:00:00:00:00)
Internet Protocol Version 4, Src: 127.0.0.53, Dst: 127.0.0.1
User Datagram Protocol, Src Port: 53, Dst Port: 13959
Domain Name System (response)

No.     Time           Source                Destination           Protocol Length Info
     23 41.904464520   127.0.0.1             127.0.0.53            ICMP     182    Destination unreachable (Port unreachable)

Frame 23: 182 bytes on wire (1456 bits), 182 bytes captured (1456 bits) on interface lo, id 0
Ethernet II, Src: 00:00:00_00:00:00 (00:00:00:00:00:00), Dst: 00:00:00_00:00:00 (00:00:00:00:00:00)
Internet Protocol Version 4, Src: 127.0.0.1, Dst: 127.0.0.53
Internet Control Message Protocol
Domain Name System (response)

No.     Time           Source                Destination           Protocol Length Info
     24 41.966354371   127.0.0.1             127.0.0.53            DNS      79     Standard query 0x74a5 A clients4.google.com

Frame 24: 79 bytes on wire (632 bits), 79 bytes captured (632 bits) on interface lo, id 0
Ethernet II, Src: 00:00:00_00:00:00 (00:00:00:00:00:00), Dst: 00:00:00_00:00:00 (00:00:00:00:00:00)
Internet Protocol Version 4, Src: 127.0.0.1, Dst: 127.0.0.53
User Datagram Protocol, Src Port: 10492, Dst Port: 53
Domain Name System (query)

No.     Time           Source                Destination           Protocol Length Info
     25 41.966383762   127.0.0.1             127.0.0.53            DNS      79     Standard query 0x0933 HTTPS clients4.google.com

Frame 25: 79 bytes on wire (632 bits), 79 bytes captured (632 bits) on interface lo, id 0
Ethernet II, Src: 00:00:00_00:00:00 (00:00:00:00:00:00), Dst: 00:00:00_00:00:00 (00:00:00:00:00:00)
Internet Protocol Version 4, Src: 127.0.0.1, Dst: 127.0.0.53
User Datagram Protocol, Src Port: 30894, Dst Port: 53
Domain Name System (query)

No.     Time           Source                Destination           Protocol Length Info
     26 41.975308927   127.0.0.53            127.0.0.1             DNS      119    Standard query response 0x74a5 A clients4.google.com CNAME clients.l.google.com A 172.217.173.238

Frame 26: 119 bytes on wire (952 bits), 119 bytes captured (952 bits) on interface lo, id 0
Ethernet II, Src: 00:00:00_00:00:00 (00:00:00:00:00:00), Dst: 00:00:00_00:00:00 (00:00:00:00:00:00)
Internet Protocol Version 4, Src: 127.0.0.53, Dst: 127.0.0.1
User Datagram Protocol, Src Port: 53, Dst Port: 10492
Domain Name System (response)

No.     Time           Source                Destination           Protocol Length Info
     27 41.987651374   127.0.0.53            127.0.0.1             DNS      153    Standard query response 0x0933 HTTPS clients4.google.com CNAME clients.l.google.com SOA ns1.google.com

Frame 27: 153 bytes on wire (1224 bits), 153 bytes captured (1224 bits) on interface lo, id 0
Ethernet II, Src: 00:00:00_00:00:00 (00:00:00:00:00:00), Dst: 00:00:00_00:00:00 (00:00:00:00:00:00)
Internet Protocol Version 4, Src: 127.0.0.53, Dst: 127.0.0.1
User Datagram Protocol, Src Port: 53, Dst Port: 30894
Domain Name System (response)

No.     Time           Source                Destination           Protocol Length Info
     28 41.987661335   127.0.0.1             127.0.0.53            ICMP     181    Destination unreachable (Port unreachable)

Frame 28: 181 bytes on wire (1448 bits), 181 bytes captured (1448 bits) on interface lo, id 0
Ethernet II, Src: 00:00:00_00:00:00 (00:00:00:00:00:00), Dst: 00:00:00_00:00:00 (00:00:00:00:00:00)
Internet Protocol Version 4, Src: 127.0.0.1, Dst: 127.0.0.53
Internet Control Message Protocol
Domain Name System (response)

No.     Time           Source                Destination           Protocol Length Info
     29 43.184540917   127.0.0.1             127.0.0.53            DNS      86     Standard query 0x9daf A waa-pa.clients6.google.com

Frame 29: 86 bytes on wire (688 bits), 86 bytes captured (688 bits) on interface lo, id 0
Ethernet II, Src: 00:00:00_00:00:00 (00:00:00:00:00:00), Dst: 00:00:00_00:00:00 (00:00:00:00:00:00)
Internet Protocol Version 4, Src: 127.0.0.1, Dst: 127.0.0.53
User Datagram Protocol, Src Port: 21186, Dst Port: 53
Domain Name System (query)

No.     Time           Source                Destination           Protocol Length Info
     30 43.184575960   127.0.0.1             127.0.0.53            DNS      86     Standard query 0x4bb5 HTTPS waa-pa.clients6.google.com

Frame 30: 86 bytes on wire (688 bits), 86 bytes captured (688 bits) on interface lo, id 0
Ethernet II, Src: 00:00:00_00:00:00 (00:00:00:00:00:00), Dst: 00:00:00_00:00:00 (00:00:00:00:00:00)
Internet Protocol Version 4, Src: 127.0.0.1, Dst: 127.0.0.53
User Datagram Protocol, Src Port: 15620, Dst Port: 53
Domain Name System (query)

No.     Time           Source                Destination           Protocol Length Info
     31 43.184642204   127.0.0.53            127.0.0.1             DNS      102    Standard query response 0x9daf A waa-pa.clients6.google.com A 142.251.133.202

Frame 31: 102 bytes on wire (816 bits), 102 bytes captured (816 bits) on interface lo, id 0
Ethernet II, Src: 00:00:00_00:00:00 (00:00:00:00:00:00), Dst: 00:00:00_00:00:00 (00:00:00:00:00:00)
Internet Protocol Version 4, Src: 127.0.0.53, Dst: 127.0.0.1
User Datagram Protocol, Src Port: 53, Dst Port: 21186
Domain Name System (response)

No.     Time           Source                Destination           Protocol Length Info
     32 43.235186713   127.0.0.53            127.0.0.1             DNS      136    Standard query response 0x4bb5 HTTPS waa-pa.clients6.google.com SOA ns1.google.com

Frame 32: 136 bytes on wire (1088 bits), 136 bytes captured (1088 bits) on interface lo, id 0
Ethernet II, Src: 00:00:00_00:00:00 (00:00:00:00:00:00), Dst: 00:00:00_00:00:00 (00:00:00:00:00:00)
Internet Protocol Version 4, Src: 127.0.0.53, Dst: 127.0.0.1
User Datagram Protocol, Src Port: 53, Dst Port: 15620
Domain Name System (response)

No.     Time           Source                Destination           Protocol Length Info
     33 43.235197294   127.0.0.1             127.0.0.53            ICMP     164    Destination unreachable (Port unreachable)

Frame 33: 164 bytes on wire (1312 bits), 164 bytes captured (1312 bits) on interface lo, id 0
Ethernet II, Src: 00:00:00_00:00:00 (00:00:00:00:00:00), Dst: 00:00:00_00:00:00 (00:00:00:00:00:00)
Internet Protocol Version 4, Src: 127.0.0.1, Dst: 127.0.0.53
Internet Control Message Protocol
Domain Name System (response)

No.     Time           Source                Destination           Protocol Length Info
     34 57.855153105   127.0.0.1             127.0.0.53            DNS      94     Standard query 0x72ff A easylist-downloads.adblockplus.org

Frame 34: 94 bytes on wire (752 bits), 94 bytes captured (752 bits) on interface lo, id 0
Ethernet II, Src: 00:00:00_00:00:00 (00:00:00:00:00:00), Dst: 00:00:00_00:00:00 (00:00:00:00:00:00)
Internet Protocol Version 4, Src: 127.0.0.1, Dst: 127.0.0.53
User Datagram Protocol, Src Port: 54345, Dst Port: 53
Domain Name System (query)

No.     Time           Source                Destination           Protocol Length Info
     35 57.855191687   127.0.0.1             127.0.0.53            DNS      94     Standard query 0x958e HTTPS easylist-downloads.adblockplus.org

Frame 35: 94 bytes on wire (752 bits), 94 bytes captured (752 bits) on interface lo, id 0
Ethernet II, Src: 00:00:00_00:00:00 (00:00:00:00:00:00), Dst: 00:00:00_00:00:00 (00:00:00:00:00:00)
Internet Protocol Version 4, Src: 127.0.0.1, Dst: 127.0.0.53
User Datagram Protocol, Src Port: 38558, Dst Port: 53
Domain Name System (query)

No.     Time           Source                Destination           Protocol Length Info
     36 58.009855972   127.0.0.53            127.0.0.1             DNS      126    Standard query response 0x72ff A easylist-downloads.adblockplus.org A 173.222.250.35 A 173.222.250.32

Frame 36: 126 bytes on wire (1008 bits), 126 bytes captured (1008 bits) on interface lo, id 0
Ethernet II, Src: 00:00:00_00:00:00 (00:00:00:00:00:00), Dst: 00:00:00_00:00:00 (00:00:00:00:00:00)
Internet Protocol Version 4, Src: 127.0.0.53, Dst: 127.0.0.1
User Datagram Protocol, Src Port: 53, Dst Port: 54345
Domain Name System (response)

No.     Time           Source                Destination           Protocol Length Info
     37 58.009912916   127.0.0.53            127.0.0.1             DNS      153    Standard query response 0x958e HTTPS easylist-downloads.adblockplus.org SOA ns11.constellix.com

Frame 37: 153 bytes on wire (1224 bits), 153 bytes captured (1224 bits) on interface lo, id 0
Ethernet II, Src: 00:00:00_00:00:00 (00:00:00:00:00:00), Dst: 00:00:00_00:00:00 (00:00:00:00:00:00)
Internet Protocol Version 4, Src: 127.0.0.53, Dst: 127.0.0.1
User Datagram Protocol, Src Port: 53, Dst Port: 38558
Domain Name System (response)

No.     Time           Source                Destination           Protocol Length Info
     38 71.638080167   127.0.0.1             127.0.0.53            DNS      79     Standard query 0x8b51 A everything.curl.dev

Frame 38: 79 bytes on wire (632 bits), 79 bytes captured (632 bits) on interface lo, id 0
Ethernet II, Src: 00:00:00_00:00:00 (00:00:00:00:00:00), Dst: 00:00:00_00:00:00 (00:00:00:00:00:00)
Internet Protocol Version 4, Src: 127.0.0.1, Dst: 127.0.0.53
User Datagram Protocol, Src Port: 4195, Dst Port: 53
Domain Name System (query)

No.     Time           Source                Destination           Protocol Length Info
     39 71.638115560   127.0.0.1             127.0.0.53            DNS      79     Standard query 0x1911 HTTPS everything.curl.dev

Frame 39: 79 bytes on wire (632 bits), 79 bytes captured (632 bits) on interface lo, id 0
Ethernet II, Src: 00:00:00_00:00:00 (00:00:00:00:00:00), Dst: 00:00:00_00:00:00 (00:00:00:00:00:00)
Internet Protocol Version 4, Src: 127.0.0.1, Dst: 127.0.0.53
User Datagram Protocol, Src Port: 21307, Dst Port: 53
Domain Name System (query)

No.     Time           Source                Destination           Protocol Length Info
     40 71.821456036   127.0.0.1             127.0.0.53            DNS      79     Standard query 0x4ce2 A everything.curl.dev

Frame 40: 79 bytes on wire (632 bits), 79 bytes captured (632 bits) on interface lo, id 0
Ethernet II, Src: 00:00:00_00:00:00 (00:00:00:00:00:00), Dst: 00:00:00_00:00:00 (00:00:00:00:00:00)
Internet Protocol Version 4, Src: 127.0.0.1, Dst: 127.0.0.53
User Datagram Protocol, Src Port: 5466, Dst Port: 53
Domain Name System (query)

No.     Time           Source                Destination           Protocol Length Info
     41 71.821509819   127.0.0.1             127.0.0.53            DNS      79     Standard query 0xea0f HTTPS everything.curl.dev

Frame 41: 79 bytes on wire (632 bits), 79 bytes captured (632 bits) on interface lo, id 0
Ethernet II, Src: 00:00:00_00:00:00 (00:00:00:00:00:00), Dst: 00:00:00_00:00:00 (00:00:00:00:00:00)
Internet Protocol Version 4, Src: 127.0.0.1, Dst: 127.0.0.53
User Datagram Protocol, Src Port: 40333, Dst Port: 53
Domain Name System (query)

No.     Time           Source                Destination           Protocol Length Info
     42 71.844608031   127.0.0.1             127.0.0.53            DNS      95     Standard query 0x1e1a A optimizationguide-pa.googleapis.com

Frame 42: 95 bytes on wire (760 bits), 95 bytes captured (760 bits) on interface lo, id 0
Ethernet II, Src: 00:00:00_00:00:00 (00:00:00:00:00:00), Dst: 00:00:00_00:00:00 (00:00:00:00:00:00)
Internet Protocol Version 4, Src: 127.0.0.1, Dst: 127.0.0.53
User Datagram Protocol, Src Port: 54915, Dst Port: 53
Domain Name System (query)

No.     Time           Source                Destination           Protocol Length Info
     43 71.844652514   127.0.0.1             127.0.0.53            DNS      95     Standard query 0xbac3 HTTPS optimizationguide-pa.googleapis.com

Frame 43: 95 bytes on wire (760 bits), 95 bytes captured (760 bits) on interface lo, id 0
Ethernet II, Src: 00:00:00_00:00:00 (00:00:00:00:00:00), Dst: 00:00:00_00:00:00 (00:00:00:00:00:00)
Internet Protocol Version 4, Src: 127.0.0.1, Dst: 127.0.0.53
User Datagram Protocol, Src Port: 61478, Dst Port: 53
Domain Name System (query)

No.     Time           Source                Destination           Protocol Length Info
     44 71.849317657   127.0.0.1             127.0.0.53            DNS      83     Standard query 0x6c48 A safebrowsing.google.com

Frame 44: 83 bytes on wire (664 bits), 83 bytes captured (664 bits) on interface lo, id 0
Ethernet II, Src: 00:00:00_00:00:00 (00:00:00:00:00:00), Dst: 00:00:00_00:00:00 (00:00:00:00:00:00)
Internet Protocol Version 4, Src: 127.0.0.1, Dst: 127.0.0.53
User Datagram Protocol, Src Port: 38669, Dst Port: 53
Domain Name System (query)

No.     Time           Source                Destination           Protocol Length Info
     45 71.849354819   127.0.0.1             127.0.0.53            DNS      83     Standard query 0x05e2 HTTPS safebrowsing.google.com

Frame 45: 83 bytes on wire (664 bits), 83 bytes captured (664 bits) on interface lo, id 0
Ethernet II, Src: 00:00:00_00:00:00 (00:00:00:00:00:00), Dst: 00:00:00_00:00:00 (00:00:00:00:00:00)
Internet Protocol Version 4, Src: 127.0.0.1, Dst: 127.0.0.53
User Datagram Protocol, Src Port: 5133, Dst Port: 53
Domain Name System (query)

No.     Time           Source                Destination           Protocol Length Info
     46 71.856258069   127.0.0.53            127.0.0.1             DNS      152    Standard query response 0xbac3 HTTPS optimizationguide-pa.googleapis.com SOA ns1.google.com

Frame 46: 152 bytes on wire (1216 bits), 152 bytes captured (1216 bits) on interface lo, id 0
Ethernet II, Src: 00:00:00_00:00:00 (00:00:00:00:00:00), Dst: 00:00:00_00:00:00 (00:00:00:00:00:00)
Internet Protocol Version 4, Src: 127.0.0.53, Dst: 127.0.0.1
User Datagram Protocol, Src Port: 53, Dst Port: 61478
Domain Name System (response)

No.     Time           Source                Destination           Protocol Length Info
     47 71.857248689   127.0.0.53            127.0.0.1             DNS      351    Standard query response 0x1e1a A optimizationguide-pa.googleapis.com A 172.217.172.74 A 172.217.172.106 A 172.217.173.234 A 216.58.202.74 A 216.58.202.106 A 142.250.79.74 A 142.250.79.106 A 142.250.79.138 A 142.251.133.10 A 142.251.133.42 A 142.251.133.74 A 142.251.133.202 A 142.251.133.234 A 142.251.134.10 A 142.251.134.42 A 142.251.134.74

Frame 47: 351 bytes on wire (2808 bits), 351 bytes captured (2808 bits) on interface lo, id 0
Ethernet II, Src: 00:00:00_00:00:00 (00:00:00:00:00:00), Dst: 00:00:00_00:00:00 (00:00:00:00:00:00)
Internet Protocol Version 4, Src: 127.0.0.53, Dst: 127.0.0.1
User Datagram Protocol, Src Port: 53, Dst Port: 54915
Domain Name System (response)

No.     Time           Source                Destination           Protocol Length Info
     48 71.861216550   127.0.0.53            127.0.0.1             DNS      118    Standard query response 0x6c48 A safebrowsing.google.com CNAME sb.l.google.com A 216.58.202.110

Frame 48: 118 bytes on wire (944 bits), 118 bytes captured (944 bits) on interface lo, id 0
Ethernet II, Src: 00:00:00_00:00:00 (00:00:00:00:00:00), Dst: 00:00:00_00:00:00 (00:00:00:00:00:00)
Internet Protocol Version 4, Src: 127.0.0.53, Dst: 127.0.0.1
User Datagram Protocol, Src Port: 53, Dst Port: 38669
Domain Name System (response)

No.     Time           Source                Destination           Protocol Length Info
     49 71.918602634   127.0.0.53            127.0.0.1             DNS      152    Standard query response 0x05e2 HTTPS safebrowsing.google.com CNAME sb.l.google.com SOA ns1.google.com

Frame 49: 152 bytes on wire (1216 bits), 152 bytes captured (1216 bits) on interface lo, id 0
Ethernet II, Src: 00:00:00_00:00:00 (00:00:00:00:00:00), Dst: 00:00:00_00:00:00 (00:00:00:00:00:00)
Internet Protocol Version 4, Src: 127.0.0.53, Dst: 127.0.0.1
User Datagram Protocol, Src Port: 53, Dst Port: 5133
Domain Name System (response)

No.     Time           Source                Destination           Protocol Length Info
     50 71.918611244   127.0.0.1             127.0.0.53            ICMP     180    Destination unreachable (Port unreachable)

Frame 50: 180 bytes on wire (1440 bits), 180 bytes captured (1440 bits) on interface lo, id 0
Ethernet II, Src: 00:00:00_00:00:00 (00:00:00:00:00:00), Dst: 00:00:00_00:00:00 (00:00:00:00:00:00)
Internet Protocol Version 4, Src: 127.0.0.1, Dst: 127.0.0.53
Internet Control Message Protocol
Domain Name System (response)

No.     Time           Source                Destination           Protocol Length Info
     51 72.125178388   127.0.0.53            127.0.0.1             DNS      190    Standard query response 0x8b51 A everything.curl.dev CNAME dualstack.n.sni.global.fastly.net A 151.101.1.91 A 151.101.65.91 A 151.101.129.91 A 151.101.193.91

Frame 51: 190 bytes on wire (1520 bits), 190 bytes captured (1520 bits) on interface lo, id 0
Ethernet II, Src: 00:00:00_00:00:00 (00:00:00:00:00:00), Dst: 00:00:00_00:00:00 (00:00:00:00:00:00)
Internet Protocol Version 4, Src: 127.0.0.53, Dst: 127.0.0.1
User Datagram Protocol, Src Port: 53, Dst Port: 4195
Domain Name System (response)

No.     Time           Source                Destination           Protocol Length Info
     52 72.125241832   127.0.0.53            127.0.0.1             DNS      190    Standard query response 0x4ce2 A everything.curl.dev CNAME dualstack.n.sni.global.fastly.net A 151.101.1.91 A 151.101.65.91 A 151.101.129.91 A 151.101.193.91

Frame 52: 190 bytes on wire (1520 bits), 190 bytes captured (1520 bits) on interface lo, id 0
Ethernet II, Src: 00:00:00_00:00:00 (00:00:00:00:00:00), Dst: 00:00:00_00:00:00 (00:00:00:00:00:00)
Internet Protocol Version 4, Src: 127.0.0.53, Dst: 127.0.0.1
User Datagram Protocol, Src Port: 53, Dst Port: 5466
Domain Name System (response)

No.     Time           Source                Destination           Protocol Length Info
     53 72.239095712   127.0.0.1             127.0.0.53            DNS      67     Standard query 0xb16e A curl.se

Frame 53: 67 bytes on wire (536 bits), 67 bytes captured (536 bits) on interface lo, id 0
Ethernet II, Src: 00:00:00_00:00:00 (00:00:00:00:00:00), Dst: 00:00:00_00:00:00 (00:00:00:00:00:00)
Internet Protocol Version 4, Src: 127.0.0.1, Dst: 127.0.0.53
User Datagram Protocol, Src Port: 54550, Dst Port: 53
Domain Name System (query)

No.     Time           Source                Destination           Protocol Length Info
     54 72.239128184   127.0.0.1             127.0.0.53            DNS      67     Standard query 0xdd3b HTTPS curl.se

Frame 54: 67 bytes on wire (536 bits), 67 bytes captured (536 bits) on interface lo, id 0
Ethernet II, Src: 00:00:00_00:00:00 (00:00:00:00:00:00), Dst: 00:00:00_00:00:00 (00:00:00:00:00:00)
Internet Protocol Version 4, Src: 127.0.0.1, Dst: 127.0.0.53
User Datagram Protocol, Src Port: 30483, Dst Port: 53
Domain Name System (query)

No.     Time           Source                Destination           Protocol Length Info
     55 72.251523236   127.0.0.53            127.0.0.1             DNS      187    Standard query response 0x1911 HTTPS everything.curl.dev CNAME dualstack.n.sni.global.fastly.net SOA ns1.fastly.net

Frame 55: 187 bytes on wire (1496 bits), 187 bytes captured (1496 bits) on interface lo, id 0
Ethernet II, Src: 00:00:00_00:00:00 (00:00:00:00:00:00), Dst: 00:00:00_00:00:00 (00:00:00:00:00:00)
Internet Protocol Version 4, Src: 127.0.0.53, Dst: 127.0.0.1
User Datagram Protocol, Src Port: 53, Dst Port: 21307
Domain Name System (response)

No.     Time           Source                Destination           Protocol Length Info
     56 72.251532897   127.0.0.1             127.0.0.53            ICMP     215    Destination unreachable (Port unreachable)

Frame 56: 215 bytes on wire (1720 bits), 215 bytes captured (1720 bits) on interface lo, id 0
Ethernet II, Src: 00:00:00_00:00:00 (00:00:00:00:00:00), Dst: 00:00:00_00:00:00 (00:00:00:00:00:00)
Internet Protocol Version 4, Src: 127.0.0.1, Dst: 127.0.0.53
Internet Control Message Protocol
Domain Name System (response)

No.     Time           Source                Destination           Protocol Length Info
     57 72.251571789   127.0.0.53            127.0.0.1             DNS      187    Standard query response 0xea0f HTTPS everything.curl.dev CNAME dualstack.n.sni.global.fastly.net SOA ns1.fastly.net

Frame 57: 187 bytes on wire (1496 bits), 187 bytes captured (1496 bits) on interface lo, id 0
Ethernet II, Src: 00:00:00_00:00:00 (00:00:00:00:00:00), Dst: 00:00:00_00:00:00 (00:00:00:00:00:00)
Internet Protocol Version 4, Src: 127.0.0.53, Dst: 127.0.0.1
User Datagram Protocol, Src Port: 53, Dst Port: 40333
Domain Name System (response)

No.     Time           Source                Destination           Protocol Length Info
     58 72.251576419   127.0.0.1             127.0.0.53            ICMP     215    Destination unreachable (Port unreachable)

Frame 58: 215 bytes on wire (1720 bits), 215 bytes captured (1720 bits) on interface lo, id 0
Ethernet II, Src: 00:00:00_00:00:00 (00:00:00:00:00:00), Dst: 00:00:00_00:00:00 (00:00:00:00:00:00)
Internet Protocol Version 4, Src: 127.0.0.1, Dst: 127.0.0.53
Internet Control Message Protocol
Domain Name System (response)

No.     Time           Source                Destination           Protocol Length Info
     59 72.252016816   127.0.0.53            127.0.0.1             DNS      131    Standard query response 0xb16e A curl.se A 151.101.65.91 A 151.101.129.91 A 151.101.193.91 A 151.101.1.91

Frame 59: 131 bytes on wire (1048 bits), 131 bytes captured (1048 bits) on interface lo, id 0
Ethernet II, Src: 00:00:00_00:00:00 (00:00:00:00:00:00), Dst: 00:00:00_00:00:00 (00:00:00:00:00:00)
Internet Protocol Version 4, Src: 127.0.0.53, Dst: 127.0.0.1
User Datagram Protocol, Src Port: 53, Dst Port: 54550
Domain Name System (response)

No.     Time           Source                Destination           Protocol Length Info
     60 72.275745586   127.0.0.53            127.0.0.1             DNS      117    Standard query response 0xdd3b HTTPS curl.se SOA ns1.haxx.se

Frame 60: 117 bytes on wire (936 bits), 117 bytes captured (936 bits) on interface lo, id 0
Ethernet II, Src: 00:00:00_00:00:00 (00:00:00:00:00:00), Dst: 00:00:00_00:00:00 (00:00:00:00:00:00)
Internet Protocol Version 4, Src: 127.0.0.53, Dst: 127.0.0.1
User Datagram Protocol, Src Port: 53, Dst Port: 30483
Domain Name System (response)

No.     Time           Source                Destination           Protocol Length Info
     61 72.275753556   127.0.0.1             127.0.0.53            ICMP     145    Destination unreachable (Port unreachable)

Frame 61: 145 bytes on wire (1160 bits), 145 bytes captured (1160 bits) on interface lo, id 0
Ethernet II, Src: 00:00:00_00:00:00 (00:00:00:00:00:00), Dst: 00:00:00_00:00:00 (00:00:00:00:00:00)
Internet Protocol Version 4, Src: 127.0.0.1, Dst: 127.0.0.53
Internet Control Message Protocol
Domain Name System (response)

No.     Time           Source                Destination           Protocol Length Info
     62 74.359061642   127.0.0.1             127.0.0.53            DNS      74     Standard query 0xaddc A www.google.com

Frame 62: 74 bytes on wire (592 bits), 74 bytes captured (592 bits) on interface lo, id 0
Ethernet II, Src: 00:00:00_00:00:00 (00:00:00:00:00:00), Dst: 00:00:00_00:00:00 (00:00:00:00:00:00)
Internet Protocol Version 4, Src: 127.0.0.1, Dst: 127.0.0.53
User Datagram Protocol, Src Port: 5314, Dst Port: 53
Domain Name System (query)

No.     Time           Source                Destination           Protocol Length Info
     63 74.359104265   127.0.0.1             127.0.0.53            DNS      74     Standard query 0xd520 HTTPS www.google.com

Frame 63: 74 bytes on wire (592 bits), 74 bytes captured (592 bits) on interface lo, id 0
Ethernet II, Src: 00:00:00_00:00:00 (00:00:00:00:00:00), Dst: 00:00:00_00:00:00 (00:00:00:00:00:00)
Internet Protocol Version 4, Src: 127.0.0.1, Dst: 127.0.0.53
User Datagram Protocol, Src Port: 48611, Dst Port: 53
Domain Name System (query)

No.     Time           Source                Destination           Protocol Length Info
     64 74.368501675   127.0.0.53            127.0.0.1             DNS      90     Standard query response 0xaddc A www.google.com A 142.250.79.100

Frame 64: 90 bytes on wire (720 bits), 90 bytes captured (720 bits) on interface lo, id 0
Ethernet II, Src: 00:00:00_00:00:00 (00:00:00:00:00:00), Dst: 00:00:00_00:00:00 (00:00:00:00:00:00)
Internet Protocol Version 4, Src: 127.0.0.53, Dst: 127.0.0.1
User Datagram Protocol, Src Port: 53, Dst Port: 5314
Domain Name System (response)

No.     Time           Source                Destination           Protocol Length Info
     65 74.372354158   127.0.0.53            127.0.0.1             DNS      99     Standard query response 0xd520 HTTPS www.google.com HTTPS

Frame 65: 99 bytes on wire (792 bits), 99 bytes captured (792 bits) on interface lo, id 0
Ethernet II, Src: 00:00:00_00:00:00 (00:00:00:00:00:00), Dst: 00:00:00_00:00:00 (00:00:00:00:00:00)
Internet Protocol Version 4, Src: 127.0.0.53, Dst: 127.0.0.1
User Datagram Protocol, Src Port: 53, Dst Port: 48611
Domain Name System (response)

No.     Time           Source                Destination           Protocol Length Info
     66 76.467779681   127.0.0.1             127.0.0.53            DNS      86     Standard query 0x701d A encrypted-tbn3.gstatic.com

Frame 66: 86 bytes on wire (688 bits), 86 bytes captured (688 bits) on interface lo, id 0
Ethernet II, Src: 00:00:00_00:00:00 (00:00:00:00:00:00), Dst: 00:00:00_00:00:00 (00:00:00:00:00:00)
Internet Protocol Version 4, Src: 127.0.0.1, Dst: 127.0.0.53
User Datagram Protocol, Src Port: 65274, Dst Port: 53
Domain Name System (query)

